{
  "version": "1",
  "command_id": "cmd-phase2e-research-software-update-0001",
  "tenant": "eduardo-research",
  "action": "research.object.update",
  "requested_by": "chatgpt",
  "payload": {
    "kind": "software",
    "post_id": 101,
    "changes": {
      "title": "Phase 2E Research Software update accepted"
    },
    "evidence_confirmed": true,
    "evidence_reference": "acceptance:phase2e:research-software:title-update"
  }
}
